{"schema_version":1,"id":"clean","name":"Clean","description":"Local deterministic cleanup for everyday dictation.","pipeline":[{"id":"normalize","processor":"builtin.normalize","execution":"local_required","data_requirements":["transcript"],"config":{}},{"id":"aliases","processor":"builtin.dictionary_aliases","execution":"local_required","data_requirements":["transcript","dictionary"],"config":{}},{"id":"cleanup","processor":"builtin.clean_text","execution":"local_required","data_requirements":["transcript","language"],"config":{}}],"output":{"preserve_line_breaks":true,"trim_outer_whitespace":true}}
